{
	"$id": "http://qsa.inf.unideb.hu/qsa-schema.json",
	"$schema": "http://json-schema.org/draft-07/schema#",
	"definitions": {
		"primitiveType": {
			"type": [
				"boolean",
				"number",
				"array",
				"string",
				"object"
			]
		},
		"configNameType": {
			"type": "string",
			"pattern": "^([0-9A-Za-z_.]*)$",
			"minLength": 3,
			"maxLength": 100
		},
		"qualifiersAsValues": {
			"type": "string",
			"minItems": 1,
			"pattern": "^([0-9A-Za-z_\\-]*)$",
			"examples": [
				"locale",
				"environment"
			]
		},
		"configCondition": {
			"type": "array",
			"minItems": 1,
			"items": {
				"$ref": "#/definitions/qualifiersAsValues"
			}
		},
		"values": {
			"type": "array",
			"minItems": 1,
			"items": {
				"properties": {
					"value": {
						"description": "The value of the config in the scenario.",
						"$ref": "#/definitions/primitiveType"
					}
				},
				"patternProperties": {
					"^(?!value$)([0-9a-zA-Z\\-_]*)$": {
						"description": "Qualifier for the given value. If the user context matches a value from each qualifier, the given config value is resolved.",
						"type": "array",
						"minItems": 1,
						"items": {
							"$ref": "#/definitions/primitiveType"
						}
					}
				},
				"additionalProperties": false,
				"required": [
					"value"
				]
			}
		}
	},
	"properties": {
		"config": {
			"description": "Name of the config being defined. Must be same as the file name.",
			"$ref": "#/definitions/configNameType"
		},
		"name": {
			"description": "Name of the config.",
			"type": "string"
		},
		"configCondition": {
			"description": "Defines the priority of config values. See examples in the doc.",
			"$ref": "#/definitions/configCondition"
		},
		"values": {
			"description": "Scenarios defining the possible values that the config can take. At least one scenario should be declared which gives the default value of the config.",
			"$ref": "#/definitions/values"
		},
		"description": {
			"description": "Short description of the config.",
			"type": "string"
		}
	},
	"required": [
		"config",
		"values"
	],
	"additionalProperties": false
}