{
  "config": "CALCULATION_INPUT_VALIDATOR",
  "name": "systemMM1K",
  "configCondition": [
    "feature"
  ],
  "values": [
    {
      "value": "smallerEqualsnFromKValidator",
      "feature": [
        "Pn",
        "n"
      ]
    },
    {
      "value": "smallernFromKValidator",
      "feature": [
        "Pin",
        "n"
      ]
    }
  ]
}