{
	"config": "CALCULATION_INPUT_VALIDATOR",
	"name": "systemMMnn",
	"configCondition": [
        "feature",
        "output"
	],
	"values": [
        {
            "value": "positiveValidator",
            "output": [
                "US"
            ],
            "feature": [
                "n"
            ]
        }
	]
}