{
  "config": "VALIDATOR_CONSTRAINTS",
  "name": "systemMMcKBalking",
  "configCondition": [
    "feature"
  ],
  "values": [
    {
      "feature": [
        "n"
      ],
      "value": "positiveOrZeroValidator"
    },
    {
      "feature": [
        "Lambda",
        "Mu",
        "c",
        "K"
      ],
      "value": "positiveValidator"
    }
  ]
}