{
  "config": "INPUT_GROUPS",
  "name": "systemMMnPrior",
  "configCondition": [
    "feature"
  ],
  "values": [
    {
      "value": "INPUT_GROUP_REQUIRED",
      "feature": [
        "Lambda1",
        "Lambda2",
        "Mu",
        "c"
      ]
    },
    {
      "value": "INPUT_GROUP_COST",
      "feature": [
        "CS",
        "CWS",
        "CI",
        "CSR",
        "R"
      ]
    }
  ]
}
