{
  "config": "VALIDATOR_CONSTRAINTS",
  "name": "systemMMn",
  "configCondition": [
    "feature"
  ],
  "values": [
    {
      "feature": [
        "n",
        "t",
        "r",
        "CS",
        "CWS",
        "CI",
        "CSR",
        "R"
      ],
      "value": "positiveOrZeroValidator"
    },
    {
      "feature": [
        "Lambda",
        "Mu",
        "c"
      ],
      "value": "positiveValidator"
    }
  ]
}
