{
  "config": "VALIDATOR_CONSTRAINTS",
  "name": "systemMHyper1KK2",
  "configCondition": [
    "feature"
  ],
  "values": [
    {
      "feature": [
        "LambdaFin",
        "Mu1",
        "Mu2",
        "p1",
        "p2",
        "KFin"
      ],
      "value": "positiveValidator"
    },
    {
        "feature": [
            "n"
        ],
        "value": "positiveOrZeroValidator"
    }
  ]
}