{
  "config": "ADDITIONAL_INFORMATION",
  "name": "systemMMnPrior",
  "configCondition": [
    "locale"
  ],
  "values": [
    {
      "value": [
        "Poisson-folyamat, c szerver",
        "Exponenciális eloszlású beérkezési időközök",
        "Exponenciális eloszlású kiszolgálási időközök",
        "Az egyes típusú igény érkezésekor a kettes típusú igény kiszolgálása nem szakad meg, de a kiszolgálás befejeződésekor az egyes típusúak kiszolgálása kezdődik"
      ],
      "locale": [
        "hu"
      ]
    },
    {
      "value": [
        "Poisson process, c servers",
        "Exponentially distributed arrival times",
        "Exponentially distributed service times",
        "Class 1 customer does not interrupt the service of class 2 request",
        "Sometimes this discipline is called HOL ( Head Of the Line )"
      ]
    }
  ]
}
