{
	"config": "ADDITIONAL_INFORMATION",
	"name": "systemMMnK",
	"configCondition": [
		"locale"
	],
	"values": [
		{
			"value": "Poisson-folyamat<br>Exponenciális eloszlású beérkezési időközök<br>Exponenciális eloszlású kiszolgálási időközök<br><b>c</b> kiszolgáló<br>Maximálisan <b>K</b> igény tartózkodhat a rendszerben",
			"locale": [
				"hu"
			]
		},
		{
			"value": "Poisson process<br>Exponentially distributed arrival times<br>Exponentially distributed service times<br><b>c</b> servers<br>System capacity is <b>K</b>"
		}
	]
}
