{
  "config": "INPUT_GROUPS",
  "name": "systemMMcmKBalkingReneging",
  "configCondition": [
    "feature"
  ],
  "values": [
    {
      "value": "INPUT_GROUP_REQUIRED",
      "feature": [
        "LambdaFin",
        "Mu",
        "c",
        "m",
        "KFin",
        "Theta"
      ]
    }
  ]
}
