{
	"config": "ADDITIONAL_INFORMATION",
	"name": "systemMM1Balking",
	"configCondition": [
		"locale"
	],
	"values": [
		{
			"value": "Poisson-folyamat<br>Exponenciális eloszlású beérkezési időközök<br>Exponenciális eloszlású kiszolgálási időközök<br><b>1</b> kiszolgáló<br>A rendszerhez az érkező igények a nagyobb sorhossz láttán egyre kisebb valószínűséggel csatlakoznak",
			"locale": [
				"hu"
			]
		},
		{
			"value": "Poisson process<br>Exponentially distributed arrival times<br>Exponentially distributed service times<br><b>1</b> server<br>Customers are discouraged, when more and more requests are present at their arrivals"
		}
	]
}
