{
  "config": "ADDITIONAL_INFORMATION",
  "name": "systemDDnKK",
  "configCondition": [
    "locale"
  ],
  "values": [
    {
      "value": [
        "Konstans érkezési időközök",
        "Konstans kiszolgálási időközök",
        "<b>c</b> kiszolgáló",
        "Maximálisan <b>K</b> igény tartózkodhat a rendszerben",
        "<b>K</b> igényforrás"
      ],
      "locale": [
        "hu"
      ]
    },
    {
      "value": [
        "Deterministic arrival times",
        "Deterministic service times",
        "<b>c</b> servers",
        "System capacity is <b>K</b>",
        "<b>K</b> sources of customers"
      ]
    }
  ]
}
